id,category,question,answer,url
83,Recherche,L'ISET Sfax publie-t-il une revue scientifique?,"Oui, l'ISET Sfax contribue à la publication de la revue 'Innovations Technologiques' qui présente les travaux de recherche de l'institut et de ses partenaires dans divers domaines technologiques.",/recherche/publications
84,Recherche,Quels sont les axes de recherche prioritaires à l'ISET Sfax?,"Les axes de recherche prioritaires à l'ISET Sfax incluent : l'industrie 4.0, les énergies renouvelables, l'intelligence artificielle, les systèmes embarqués, le développement durable, et l'innovation dans les procédés industriels.",/recherche/axes-prioritaires
85,Recherche,Existe-t-il des collaborations avec des entreprises pour la recherche?,"Oui, l'ISET Sfax maintient des collaborations étroites avec le secteur industriel pour des projets de recherche appliquée. Ces partenariats concernent notamment le développement de solutions innovantes, l'optimisation des processus et l'amélioration des produits.",/recherche/partenariats-industriels
86,Recherche,Comment sont financés les projets de recherche à l'ISET Sfax?,"Les projets de recherche à l'ISET Sfax sont financés par différentes sources : subventions ministérielles, programmes nationaux de recherche, projets européens (Erasmus+, Horizon Europe), contrats avec des entreprises privées, et fondations internationales.",/recherche/financement
87,Recherche,L'ISET Sfax organise-t-il des conférences scientifiques?,"Oui, l'ISET Sfax organise régulièrement des conférences scientifiques nationales et internationales, ainsi que des workshops thématiques dans ses domaines d'expertise. Ces événements réunissent chercheurs, industriels et étudiants.",/recherche/evenements
88,Recherche,Y a-t-il des brevets déposés par l'ISET Sfax?,"Oui, l'ISET Sfax a déposé plusieurs brevets issus de ses travaux de recherche, notamment dans les domaines des énergies renouvelables, des systèmes embarqués et des procédés industriels innovants.",/recherche/brevets
89,Recherche,Comment accéder aux publications des chercheurs de l'ISET Sfax?,"Les publications des chercheurs de l'ISET Sfax peuvent être consultées dans le dépôt institutionnel accessible depuis le site web de l'institut. Certaines publications sont également disponibles sur des plateformes académiques comme ResearchGate ou Google Scholar.",/recherche/acces-publications
90,Recherche,Existe-t-il un doctorat à l'ISET Sfax?,"L'ISET Sfax ne délivre pas directement de doctorat, mais ses enseignants-chercheurs peuvent encadrer des doctorants en cotutelle avec des universités partenaires. Les étudiants de l'ISET peuvent poursuivre en doctorat après leur mastère dans d'autres institutions.",/recherche/doctorat
91,Recherche,Comment les résultats de recherche sont-ils valorisés?,"Les résultats de recherche sont valorisés à travers des publications scientifiques, des brevets, des transferts de technologie vers l'industrie, la création de startups, et l'intégration des innovations dans les formations dispensées à l'institut.",/recherche/valorisation
92,Recherche,Existe-t-il des prix ou distinctions pour les chercheurs?,"Oui, l'ISET Sfax reconnaît l'excellence en recherche par des prix annuels décernés aux meilleurs chercheurs et innovateurs. L'institut célèbre également les succès de ses chercheurs dans des compétitions nationales et internationales.",/recherche/prix-et-distinctions
93,Recherche,L'ISET Sfax dispose-t-il d'équipements spécifiques pour la recherche?,"Oui, l'ISET Sfax dispose de laboratoires équipés d'instruments de pointe pour la recherche dans ses domaines d'expertise : prototypage rapide, analyse de matériaux, test de systèmes électroniques, simulation numérique, etc.",/recherche/equipements
94,Recherche,Comment s'impliquent les étudiants dans la recherche?,"Les étudiants s'impliquent dans la recherche principalement à travers leurs projets de fin d'études, des stages dans les laboratoires, la participation à des challenges d'innovation, et l'association à des publications pour les plus performants.",/recherche/implication-etudiante
95,Recherche,Existe-t-il des bourses de recherche pour les étudiants?,"Oui, des bourses de recherche sont disponibles pour les étudiants impliqués dans des projets spécifiques, particulièrement au niveau mastère. Ces bourses peuvent provenir de financements institutionnels ou de projets en partenariat avec l'industrie.",/recherche/bourses
96,Recherche,L'ISET Sfax participe-t-il à des réseaux de recherche internationaux?,"Oui, l'ISET Sfax est membre de plusieurs réseaux de recherche internationaux, notamment dans les domaines des technologies de l'information, de l'énergie et du développement durable, facilitant les collaborations et échanges scientifiques.",/recherche/reseaux-internationaux
97,Recherche,Comment proposer un projet de recherche collaboratif?,"Pour proposer un projet de recherche collaboratif, les entreprises ou institutions intéressées peuvent contacter la direction de la recherche de l'ISET Sfax ou directement les responsables des laboratoires concernés. Un formulaire de proposition est disponible sur le site web.",/recherche/proposer-collaboration
98,Recherche,Quels sont les indicateurs de performance en recherche à l'ISET Sfax?,"Les principaux indicateurs de performance en recherche à l'ISET Sfax incluent le nombre de publications dans des revues indexées, les brevets déposés, les projets financés, les partenariats industriels, et l'impact des innovations sur le secteur socio-économique.",/recherche/indicateurs
99,Recherche,L'ISET Sfax dispose-t-il d'un incubateur pour les projets innovants?,"Oui, l'ISET Sfax héberge un incubateur technologique qui accompagne les projets innovants issus de la recherche vers la création d'entreprises. Des espaces de travail, du mentorat et un réseau de partenaires sont mis à disposition des porteurs de projets.",/recherche/incubateur
100,Recherche,Comment l'ISET Sfax assure-t-il le transfert technologique?,"L'ISET Sfax assure le transfert technologique à travers une cellule dédiée qui facilite la valorisation des résultats de recherche, établit des partenariats avec l'industrie, et accompagne les chercheurs dans la protection et la commercialisation de leurs innovations.",/recherche/transfert-technologique
101,International,Quels sont les partenariats internationaux de l'ISET Sfax?,"L'ISET Sfax maintient des partenariats avec diverses institutions internationales, principalement en Europe (France, Italie, Espagne), en Afrique du Nord et au Moyen-Orient. Ces partenariats concernent la mobilité étudiante, les échanges académiques et les projets de recherche communs.",/relations-internationales/partenaires
102,International,Comment participer à un programme d'échange international?,"Pour participer à un programme d'échange international, les étudiants doivent candidater auprès du bureau des relations internationales de l'ISET Sfax. La sélection se fait sur dossier, incluant les résultats académiques et la motivation. Les programmes Erasmus+ sont particulièrement actifs.",/relations-internationales/programmes-dechange
103,International,L'ISET Sfax propose-t-il des stages à l'étranger?,"Oui, l'ISET Sfax facilite l'accès à des stages internationaux grâce à ses partenariats avec des entreprises et institutions étrangères. Le bureau des relations internationales accompagne les étudiants dans leurs démarches de candidature et de préparation.",/relations-internationales/stages-internationaux
104,International,Existe-t-il des doubles diplômes avec des universités étrangères?,"Oui, l'ISET Sfax a établi des accords de double diplôme avec certaines universités partenaires, permettant aux étudiants de valider simultanément un diplôme tunisien et un diplôme étranger après un parcours partiellement effectué dans chaque institution.",/relations-internationales/doubles-diplomes
105,International,Comment les enseignants peuvent-ils participer à la mobilité internationale?,"Les enseignants peuvent participer à la mobilité internationale à travers des programmes comme Erasmus+, des missions d'enseignement de courte durée, des projets de recherche collaboratifs, ou des sabbatiques dans des institutions partenaires.",/relations-internationales/mobilite-enseignants
106,International,L'ISET Sfax accueille-t-il des étudiants étrangers?,"Oui, l'ISET Sfax accueille des étudiants étrangers, principalement dans le cadre de programmes d'échange ou de mobilité, mais aussi des étudiants internationaux réguliers, notamment des pays africains et arabes.",/relations-internationales/accueil-etudiants-etrangers
107,International,Quelles sont les langues requises pour les échanges internationaux?,"Pour les échanges internationaux, la maîtrise du français est généralement suffisante pour les partenariats francophones. Pour d'autres destinations, l'anglais est souvent requis. Le niveau de compétence linguistique demandé varie selon les programmes et les institutions partenaires.",/relations-internationales/exigences-linguistiques
108,International,L'ISET Sfax participe-t-il à des projets européens?,"Oui, l'ISET Sfax participe activement à des projets européens comme Erasmus+, Horizon Europe, et d'autres initiatives de coopération méditerranéenne, tant dans le domaine de la formation que de la recherche et innovation.",/relations-internationales/projets-europeens
109,International,Existe-t-il des cours dispensés en anglais à l'ISET Sfax?,"Certains modules spécialisés, particulièrement dans les formations de mastère ou les programmes en partenariat international, sont dispensés en anglais à l'ISET Sfax pour faciliter la mobilité et préparer les étudiants au contexte international.",/relations-internationales/cours-en-anglais
110,International,Comment obtenir une attestation pour un visa d'études à l'étranger?,"Pour obtenir une attestation pour un visa d'études à l'étranger, les étudiants sélectionnés pour un programme d'échange doivent en faire la demande auprès du bureau des relations internationales qui délivrera les documents nécessaires en coordination avec l'institution partenaire.",/relations-internationales/documents-visa
111,International,Y a-t-il des financements spécifiques pour la mobilité internationale?,"Oui, des financements spécifiques sont disponibles pour la mobilité internationale, principalement à travers les bourses Erasmus+, les programmes de coopération bilatérale, et certaines fondations. Le montant et les conditions varient selon les programmes.",/relations-internationales/financement-mobilite
112,International,Comment valoriser une expérience internationale dans son parcours?,"Une expérience internationale est valorisée dans le parcours étudiant par la reconnaissance des crédits acquis à l'étranger (ECTS), l'enrichissement du CV, l'acquisition de compétences linguistiques et interculturelles, et potentiellement l'obtention d'un double diplôme.",/relations-internationales/valorisation-experience
113,International,L'ISET Sfax organise-t-il des événements internationaux?,"Oui, l'ISET Sfax organise régulièrement des événements internationaux comme des conférences scientifiques, des ateliers thématiques, des semaines internationales, et des rencontres interculturelles pour promouvoir les échanges et la coopération.",/relations-internationales/evenements
114,International,Comment préparer sa candidature pour un programme d'échange?,"Pour préparer sa candidature à un programme d'échange, l'étudiant doit constituer un dossier comprenant ses relevés de notes, une lettre de motivation, un CV, des lettres de recommandation, et éventuellement un certificat de compétence linguistique. Des ateliers de préparation sont organisés.",/relations-internationales/preparer-candidature
115,International,Quelles sont les destinations les plus populaires pour les étudiants de l'ISET Sfax?,"Les destinations les plus populaires pour les étudiants de l'ISET Sfax en mobilité internationale sont la France, l'Italie, l'Espagne, l'Allemagne et la Belgique en Europe, ainsi que certains pays du Maghreb et du Moyen-Orient pour des échanges régionaux.",/relations-internationales/destinations-populaires
116,International,Comment les crédits obtenus à l'étranger sont-ils reconnus?,"Les crédits obtenus à l'étranger sont reconnus selon le système ECTS (European Credit Transfer System). Un contrat d'études est établi avant le départ pour garantir la reconnaissance des cours suivis à l'étranger dans le cursus de l'étudiant à l'ISET Sfax.",/relations-internationales/reconnaissance-credits
117,International,Existe-t-il des summer schools ou programmes courts à l'international?,"Oui, l'ISET Sfax participe à des summer schools et programmes courts internationaux, permettant aux étudiants de vivre une expérience internationale condensée durant les vacances d'été ou d'hiver, souvent centrée sur une thématique spécifique.",/relations-internationales/programmes-courts
118,International,Comment contacter le bureau des relations internationales?,"Le bureau des relations internationales de l'ISET Sfax peut être contacté par email à international@isetsf.rnu.tn ou par téléphone au +216 74 431 XXX. Des permanences sont également assurées dans les locaux de l'administration selon un horaire affiché.",/relations-internationales/contact
119,International,L'ISET Sfax participe-t-il à des réseaux universitaires internationaux?,"Oui, l'ISET Sfax est membre de plusieurs réseaux universitaires internationaux comme le réseau des institutions technologiques méditerranéennes, l'association des universités francophones, et d'autres consortiums thématiques favorisant la coopération académique.",/relations-internationales/reseaux-universitaires
120,International,Comment se déroule l'accueil des professeurs invités internationaux?,"L'accueil des professeurs invités internationaux est coordonné par le bureau des relations internationales. Un programme est établi incluant les activités d'enseignement, des rencontres avec les équipes de recherche, et éventuellement des visites culturelles. Un logement et un support logistique sont fournis.",/relations-internationales/professeurs-invites
121,Stages et emploi,Comment trouver un stage en entreprise via l'ISET Sfax?,"Pour trouver un stage en entreprise, les étudiants peuvent consulter les offres publiées par le bureau des stages de l'ISET Sfax, participer aux forums entreprises organisés annuellement, ou solliciter l'aide de leurs enseignants qui disposent souvent d'un réseau professionnel.",/stages-emploi/recherche-stage
122,Stages et emploi,Quelle est la durée typique d'un stage de fin d'études?,"La durée typique d'un stage de fin d'études à l'ISET Sfax est de 4 à 6 mois pour les licences et jusqu'à 6 mois pour les mastères. Cette période permet aux étudiants de réaliser un projet significatif en entreprise.",/stages-emploi/duree-stage
123,Stages et emploi,Comment est évalué le stage de fin d'études?,"Le stage de fin d'études est évalué sur la base du rapport écrit, de la soutenance orale devant un jury, et de l'évaluation du maître de stage en entreprise. Ces trois composantes contribuent à la note finale selon une pondération définie par le département.",/stages-emploi/evaluation-stage
124,Stages et emploi,L'ISET Sfax organise-t-il des forums de recrutement?,"Oui, l'ISET Sfax organise annuellement un forum entreprises où les étudiants peuvent rencontrer des recruteurs potentiels, découvrir des opportunités de stages et d'emploi, et élargir leur réseau professionnel.",/stages-emploi/forum-entreprises
125,Stages et emploi,Existe-t-il une cellule d'aide à l'insertion professionnelle?,"Oui, l'ISET Sfax dispose d'une cellule d'insertion professionnelle qui accompagne les étudiants et jeunes diplômés dans leur recherche d'emploi, organise des ateliers sur les techniques de recherche d'emploi, et maintient des relations avec les employeurs.",/stages-emploi/insertion-professionnelle
126,Stages et emploi,Comment rédiger un bon CV et une lettre de motivation?,"La cellule d'insertion professionnelle de l'ISET Sfax propose régulièrement des ateliers sur la rédaction de CV et de lettres de motivation. Des modèles et conseils sont également disponibles sur l'intranet étudiant et des séances individuelles de coaching peuvent être proposées.",/stages-emploi/redaction-cv
127,Stages et emploi,Quel est le taux d'insertion professionnelle des diplômés?,"Le taux d'insertion professionnelle des diplômés de l'ISET Sfax varie selon les filières, mais se situe généralement entre 70% et 85% dans les 12 mois suivant l'obtention du diplôme. Les secteurs techniques comme l'informatique et l'électronique affichent les meilleurs taux.",/stages-emploi/taux-insertion
128,Stages et emploi,Les stages sont-ils rémunérés?,"La rémunération des stages dépend de la politique de l'entreprise d'accueil. Bien que non obligatoire en Tunisie pour les stages académiques, de nombreuses entreprises offrent une indemnité, particulièrement pour les stages de longue durée ou les projets de fin d'études.",/stages-emploi/remuneration-stages
129,Stages et emploi,Comment l'ISET Sfax aide-t-il les étudiants entrepreneurs?,"L'ISET Sfax soutient les étudiants entrepreneurs à travers son incubateur de projets, des formations spécialisées en entrepreneuriat, des concours d'innovation, et un accompagnement personnalisé pour la création d'entreprises technologiques.",/stages-emploi/entrepreneuriat-etudiant
130,Stages et emploi,Existe-t-il des conventions avec des entreprises pour les stages?,"Oui, l'ISET Sfax a établi des conventions-cadres avec de nombreuses entreprises régionales et nationales pour faciliter l'accueil des stagiaires. Ces partenariats assurent un flux régulier d'opportunités de stages pour les étudiants.",/stages-emploi/conventions-entreprises
131,Stages et emploi,Comment se préparer à un entretien d'embauche?,"La cellule d'insertion professionnelle propose des ateliers de préparation aux entretiens d'embauche, incluant des simulations, des conseils sur la présentation personnelle, et des techniques pour mettre en valeur ses compétences face aux recruteurs.",/stages-emploi/preparation-entretien
132,Stages et emploi,Les anciens diplômés peuvent-ils accéder aux services d'emploi?,"Oui, les anciens diplômés peuvent continuer à bénéficier des services de la cellule d'insertion professionnelle pendant deux ans après l'obtention de leur diplôme, incluant l'accès aux offres d'emploi et aux ateliers de formation.",/stages-emploi/services-anciens
133,Stages et emploi,Comment valoriser son stage dans son CV?,"Pour valoriser son stage dans son CV, il est recommandé de mettre en avant les compétences acquises, les projets réalisés, les résultats obtenus et les technologies maîtrisées, plutôt que de simplement mentionner l'entreprise et la durée.",/stages-emploi/valorisation-stage
134,Stages et emploi,Y a-t-il des périodes spécifiques pour effectuer un stage?,"Les stages de fin d'études se déroulent généralement au dernier semestre du cursus (février-juin pour les licences). Des stages d'été peuvent être effectués entre les années académiques, et certains programmes prévoient des alternances stage-formation.",/stages-emploi/periodes-stage
135,Stages et emploi,Peut-on effectuer un stage à l'étranger?,"Oui, les étudiants de l'ISET Sfax peuvent effectuer des stages à l'étranger, notamment grâce aux programmes d'échange internationaux comme Erasmus+ ou via les partenariats établis avec des entreprises internationales.",/stages-emploi/stages-internationaux
136,Stages et emploi,Comment l'ISET Sfax maintient-il le contact avec ses alumni?,"L'ISET Sfax maintient le contact avec ses alumni à travers l'association des anciens étudiants, un réseau LinkedIn dédié, des événements annuels de retrouvailles, et une newsletter spécifique partageant les succès et opportunités.",/stages-emploi/reseau-alumni
137,Stages et emploi,Les stages peuvent-ils déboucher sur une embauche?,"Oui, les stages constituent souvent une voie privilégiée vers l'embauche. Environ 30% des stagiaires de fin d'études à l'ISET Sfax se voient proposer un contrat dans leur entreprise d'accueil à l'issue du stage.",/stages-emploi/stages-vers-emploi
138,Stages et emploi,Comment l'ISET Sfax adapte-t-il ses formations aux besoins du marché?,"L'ISET Sfax adapte ses formations aux besoins du marché grâce à un conseil de perfectionnement incluant des professionnels, des enquêtes régulières auprès des employeurs, et la révision périodique des programmes pour intégrer les compétences émergentes.",/stages-emploi/adaptation-formations
139,Stages et emploi,Existe-t-il des formations en alternance à l'ISET Sfax?,"Certaines formations de l'ISET Sfax, particulièrement au niveau mastère professionnel, sont proposées en formule d'alternance, permettant aux étudiants de partager leur temps entre l'institut et l'entreprise pour une meilleure insertion professionnelle.",/stages-emploi/formations-alternance
140,Stages et emploi,Comment accéder aux offres d'emploi pour les diplômés?,"Les offres d'emploi pour les diplômés sont accessibles via la plateforme carrière de l'ISET Sfax, le groupe LinkedIn des alumni, et les tableaux d'affichage physiques et virtuels de la cellule d'insertion professionnelle.",/stages-emploi/offres-emploi
141,Infrastructure,Quels types de laboratoires sont disponibles à l'ISET Sfax?,"L'ISET Sfax dispose de laboratoires spécialisés dans chaque département : laboratoires d'informatique, d'électronique, d'automatisme, de mécanique, de résistance des matériaux, de génie civil, et de langues, tous équipés de matériel moderne et professionnel.",/infrastructure/laboratoires
142,Infrastructure,Comment accéder aux salles informatiques en dehors des heures de cours?,"Les salles informatiques sont accessibles en dehors des heures de cours selon un planning affiché à l'entrée de chaque salle. Les étudiants doivent présenter leur carte d'étudiant au responsable de salle et respecter le règlement d'utilisation.",/infrastructure/acces-salles-informatiques
143,Infrastructure,Existe-t-il des espaces de travail collaboratif?,"Oui, l'ISET Sfax dispose d'espaces de travail collaboratif dans la bibliothèque, d'espaces de coworking dans l'incubateur, et de salles de projet que les étudiants peuvent réserver pour leurs travaux de groupe.",/infrastructure/espaces-collaboratifs
144,Infrastructure,Quels équipements sportifs sont disponibles sur le campus?,"Le campus dispose d'un terrain de football, d'un terrain multisports, d'une salle de musculation, et d'espaces pour les sports individuels. Ces installations sont accessibles aux étudiants selon un planning établi par le service des sports.",/infrastructure/equipements-sportifs
145,Infrastructure,La bibliothèque propose-t-elle des ressources numériques?,"Oui, la bibliothèque de l'ISET Sfax offre un accès à des ressources numériques incluant des e-books, des revues scientifiques en ligne, des bases de données spécialisées, et des plateformes d'apprentissage accessibles via le réseau de l'institut ou à distance.",/infrastructure/bibliotheque-numerique
146,Infrastructure,Y a-t-il des salles d'étude disponibles 24h/24?,"Non, les salles d'étude ne sont pas disponibles 24h/24, mais la bibliothèque et certaines salles de travail sont ouvertes jusqu'à 20h en semaine et le samedi matin. Pendant les périodes d'examens, des horaires étendus peuvent être proposés.",/infrastructure/horaires-salles-etude
147,Infrastructure,Comment réserver une salle pour un événement étudiant?,"Pour réserver une salle pour un événement étudiant, il faut soumettre une demande écrite au service des affaires estudiantines au moins deux semaines à l'avance, précisant la nature de l'événement, la date, l'heure et les besoins spécifiques.",/infrastructure/reservation-salles
148,Infrastructure,L'ISET Sfax dispose-t-il d'un auditorium?,"Oui, l'ISET Sfax dispose d'un auditorium moderne d'une capacité de 300 places, équipé de systèmes audiovisuels avancés, utilisé pour les conférences, les cérémonies officielles et les grands événements culturels.",/infrastructure/auditorium
149,Infrastructure,Existe-t-il des laboratoires de langues?,"Oui, l'ISET Sfax dispose de laboratoires de langues équipés de matériel audiovisuel interactif permettant l'apprentissage pratique des langues étrangères, principalement l'anglais, le français et l'allemand.",/infrastructure/laboratoires-langues
150,Infrastructure,Comment accéder au réseau Wi-Fi du campus?,"Pour accéder au réseau Wi-Fi du campus, les étudiants doivent utiliser leurs identifiants institutionnels fournis lors de l'inscription. La couverture Wi-Fi s'étend à tous les bâtiments principaux et espaces communs du campus.",/infrastructure/wifi-campus
151,Infrastructure,Y a-t-il des imprimantes et photocopieurs à disposition des étudiants?,"Oui, des imprimantes et photocopieurs sont disponibles à la bibliothèque et dans certains départements. Un système de quota d'impression est appliqué, et les étudiants peuvent recharger leur compte à la régie de l'institut.",/infrastructure/services-impression
152,Infrastructure,Existe-t-il des infrastructures adaptées aux personnes à mobilité réduite?,"Oui, l'ISET Sfax a aménagé ses infrastructures pour les rendre accessibles aux personnes à mobilité réduite : rampes d'accès, ascenseurs, sanitaires adaptés et places de parking réservées sont disponibles sur l'ensemble du campus.",/infrastructure/accessibilite
