id,category,question,answer,url
153,Infrastructure,L'ISET Sfax dispose-t-il d'un service de maintenance informatique?,"Oui, un service de maintenance informatique est disponible pour résoudre les problèmes techniques sur les équipements de l'institut. Les étudiants peuvent signaler les dysfonctionnements via un formulaire en ligne ou auprès du responsable de salle.",/infrastructure/maintenance-informatique
154,Infrastructure,Comment est organisée la sécurité sur le campus?,"La sécurité sur le campus est assurée par un service de gardiennage présent 24h/24, un système de vidéosurveillance dans les zones sensibles, et un contrôle d'accès aux bâtiments en dehors des heures d'ouverture régulières.",/infrastructure/securite-campus
155,Infrastructure,Existe-t-il des espaces verts et de détente?,"Oui, le campus comprend plusieurs espaces verts aménagés avec des bancs et des zones ombragées, ainsi qu'une place centrale servant de lieu de rencontre et de détente pour la communauté de l'institut.",/infrastructure/espaces-verts
156,Infrastructure,Les salles de cours sont-elles équipées de matériel audiovisuel?,"Oui, la majorité des salles de cours sont équipées de vidéoprojecteurs, d'écrans et de systèmes audio. Les amphithéâtres disposent d'équipements plus avancés incluant des systèmes de sonorisation et d'enregistrement.",/infrastructure/equipement-audiovisuel
157,Infrastructure,Comment fonctionnent les laboratoires de travaux pratiques?,"Les laboratoires de travaux pratiques fonctionnent par groupes restreints d'étudiants selon un planning établi. Chaque séance est encadrée par un enseignant et éventuellement un technicien spécialisé, avec des postes de travail équipés du matériel nécessaire.",/infrastructure/fonctionnement-tp
158,Infrastructure,Y a-t-il des casiers disponibles pour les étudiants?,"Oui, des casiers sont disponibles pour les étudiants dans certains bâtiments, particulièrement près des laboratoires techniques. L'attribution se fait en début d'année auprès du service de scolarité, avec une caution remboursable.",/infrastructure/casiers-etudiants
159,Infrastructure,Existe-t-il un fab lab ou un espace de prototypage?,"Oui, l'ISET Sfax dispose d'un fab lab équipé d'imprimantes 3D, de machines à découpe laser, et d'outils de prototypage rapide. Cet espace est accessible aux étudiants pour leurs projets après une formation initiale aux équipements.",/infrastructure/fablab
160,Infrastructure,Comment sont équipés les laboratoires de recherche?,"Les laboratoires de recherche sont équipés d'instruments spécialisés selon leur domaine : équipements d'analyse et de mesure, systèmes embarqués, outils de simulation numérique, et matériel d'expérimentation avancé, financés par des projets de recherche nationaux et internationaux.",/infrastructure/equipement-recherche
161,Calendrier,Quand commence l'année universitaire à l'ISET Sfax?,"L'année universitaire à l'ISET Sfax commence généralement mi-septembre pour les étudiants de 2ème et 3ème année, et début octobre pour les nouveaux inscrits en 1ère année. Une semaine d'intégration est organisée pour ces derniers.",/calendrier/rentree-universitaire
162,Calendrier,Quelles sont les dates des examens du premier semestre à l'ISET Sfax?,"Les examens du premier semestre à l'ISET Sfax se déroulent généralement durant les deux dernières semaines de janvier. Les dates précises sont communiquées par l'administration environ un mois avant le début des épreuves via le site web et les tableaux d'affichage.",/calendrier/examens-premier-semestre
163,Calendrier,Quand se déroulent les examens du deuxième semestre à l'ISET Sfax?,"Les examens du deuxième semestre à l'ISET Sfax sont programmés habituellement durant les deux dernières semaines de mai. Le calendrier détaillé est publié sur le site de l'institut et affiché dans les départements environ trois semaines avant le début des épreuves.",/calendrier/examens-deuxieme-semestre
164,Calendrier,Quelles sont les dates des sessions de rattrapage à l'ISET Sfax?,"Les sessions de rattrapage à l'ISET Sfax sont organisées généralement début juillet, environ deux semaines après la publication des résultats des examens du deuxième semestre. Les étudiants concernés doivent s'inscrire aux matières à rattraper selon les procédures indiquées par l'administration.",/calendrier/sessions-rattrapage
165,Calendrier,Quand ont lieu les vacances universitaires à l'ISET Sfax?,"L'ISET Sfax suit le calendrier universitaire national avec les vacances suivantes : vacances d'hiver (dernière semaine de décembre et première semaine de janvier), vacances de printemps (une semaine fin mars), et vacances d'été (de fin juin à mi-septembre). Des jours fériés supplémentaires sont observés pour les fêtes nationales et religieuses.",/calendrier/vacances-universitaires
166,Calendrier,Quand commence l'inscription administrative à l'ISET Sfax?,"L'inscription administrative pour les nouveaux étudiants à l'ISET Sfax débute généralement mi-août et se poursuit jusqu'à fin septembre. Pour les étudiants déjà inscrits, la période de réinscription commence début août et se termine mi-septembre. Les dates précises sont publiées annuellement sur le site web de l'institut.",/calendrier/inscription-administrative
167,Calendrier,Quand sont publiés les résultats des examens à l'ISET Sfax?,"Les résultats des examens du premier semestre sont généralement publiés mi-février, tandis que ceux du deuxième semestre sont disponibles vers mi-juin. Les résultats de la session de rattrapage sont communiqués fin juillet. Tous les résultats sont affichés dans les départements et disponibles sur l'espace étudiant du site web.",/calendrier/publication-resultats
168,Calendrier,Quelle est la date limite pour déposer une demande de changement de filière à l'ISET Sfax?,"La date limite pour déposer une demande de changement de filière à l'ISET Sfax est fixée à une semaine après la publication des résultats finaux (après la session de rattrapage). Les demandes doivent être soumises au service de scolarité avec justificatifs appropriés. Les réponses sont communiquées avant la rentrée universitaire.",/calendrier/changement-filiere
169,Calendrier,Quand se déroulent les soutenances de PFE à l'ISET Sfax?,"Les soutenances de Projets de Fin d'Études (PFE) à l'ISET Sfax se déroulent généralement durant la première quinzaine de juin pour la session principale et la première semaine de septembre pour la session exceptionnelle. Les dates exactes sont fixées par département et communiquées aux étudiants concernés un mois à l'avance.",/calendrier/soutenances-pfe
170,Calendrier,Quelles sont les horaires des cours à l'ISET Sfax?,"Les cours à l'ISET Sfax se déroulent du lundi au samedi, de 8h00 à 18h00. La durée d'une séance est de 1h30. Une pause déjeuner est prévue entre 12h00 et 13h30. Les emplois du temps spécifiques par groupe et par semestre sont affichés dans les départements et disponibles sur l'espace étudiant du site.",/calendrier/horaires-cours
171,Calendrier,Quand sont programmées les réunions d'information de rentrée à l'ISET Sfax?,"Les réunions d'information de rentrée à l'ISET Sfax sont organisées pendant la première semaine de cours. Pour les nouveaux étudiants, elles ont lieu durant la semaine d'intégration, début octobre. Ces réunions sont obligatoires car elles présentent l'organisation des études, les règlements et les services disponibles.",/calendrier/reunions-information-rentree
172,Calendrier,Quand peut-on consulter les emplois du temps à l'ISET Sfax?,"Les emplois du temps à l'ISET Sfax sont publiés une semaine avant le début des cours de chaque semestre. Ils sont disponibles sur le site web de l'institut, affichés dans les départements et accessibles via l'espace étudiant. Des mises à jour peuvent être effectuées durant les deux premières semaines du semestre.",/calendrier/consultation-emplois-temps
173,Calendrier,À quelle date faut-il commencer à chercher un stage à l'ISET Sfax?,"La recherche de stage à l'ISET Sfax devrait idéalement commencer 3 mois avant la période prévue. Pour les stages de PFE (février-mai), il est recommandé de débuter les recherches dès octobre. Pour les stages d'été, commencez vos démarches en mars. Le bureau des stages peut vous accompagner dans cette recherche.",/calendrier/recherche-stage
174,Calendrier,Quand sont organisées les journées portes ouvertes à l'ISET Sfax?,"Les journées portes ouvertes à l'ISET Sfax sont généralement organisées durant la deuxième quinzaine de mars. Ces journées permettent aux futurs bacheliers de découvrir l'institut, ses filières et ses installations. Des démonstrations et des rencontres avec étudiants et enseignants sont au programme.",/calendrier/journees-portes-ouvertes
175,Calendrier,Quelle est la période d'orientation universitaire pour les bacheliers souhaitant intégrer l'ISET Sfax?,"La période d'orientation universitaire pour les bacheliers souhaitant intégrer l'ISET Sfax débute généralement une semaine après l'annonce des résultats du baccalauréat (fin juin) et dure environ deux semaines. Les candidats doivent suivre la procédure d'orientation sur le site www.orientation.tn et placer l'ISET Sfax parmi leurs choix.",/calendrier/orientation-universitaire
176,Calendrier,Quand débute la période des stages PFE à l'ISET Sfax?,"La période des stages PFE à l'ISET Sfax débute officiellement le 1er février et s'étend jusqu'à fin mai, pour une durée totale de quatre mois. Une convention de stage doit être signée et déposée au service des stages avant le démarrage. Les étudiants peuvent commencer leurs recherches dès le début du premier semestre.",/calendrier/periode-stages-pfe
177,Calendrier,Quelles sont les dates des conseils de classe à l'ISET Sfax?,"Les conseils de classe à l'ISET Sfax se réunissent deux fois par an : mi-février pour délibérer sur les résultats du premier semestre, et début juin pour le deuxième semestre. Un conseil supplémentaire a lieu fin juillet après la session de rattrapage. Ces conseils décident du passage des étudiants au niveau supérieur.",/calendrier/conseils-classe
178,Calendrier,Quand se déroulent les élections des représentants étudiants à l'ISET Sfax?,"Les élections des représentants étudiants à l'ISET Sfax se déroulent généralement durant la première quinzaine de novembre. Chaque groupe élit un délégué qui participera aux réunions avec l'administration et les enseignants. Les candidatures sont ouvertes deux semaines avant la date des élections.",/calendrier/elections-representants-etudiants
179,Calendrier,À quelle date faut-il déposer les demandes de bourse et de logement universitaire à l'ISET Sfax?,"Les demandes de bourse et de logement universitaire pour les étudiants de l'ISET Sfax doivent être déposées entre début juillet et mi-août via le site de l'Office des Œuvres Universitaires (www.oous.rnu.tn). Les nouveaux bacheliers doivent soumettre leur demande dès l'obtention de leur affectation à l'ISET Sfax.",/calendrier/demandes-bourse-logement
180,Calendrier,Quand sont programmées les activités culturelles et sportives à l'ISET Sfax?,"Les activités culturelles et sportives à l'ISET Sfax sont programmées principalement les mercredis après-midi, période réservée aux activités parascolaires. Un calendrier détaillé est publié en début d'année universitaire. Les événements majeurs comme le tournoi sportif inter-départements se déroulent généralement en avril.",/calendrier/activites-culturelles-sportives
181,Contact,Quelle est l'adresse exacte de l'ISET Sfax?,"L'adresse exacte de l'ISET Sfax est : Institut Supérieur des Études Technologiques de Sfax, Route de Mahdia Km 2.5, BP 88A, 3099 Sfax, Tunisie.",/contact/adresse-exacte
182,Contact,Quel est le numéro de téléphone du standard de l'ISET Sfax?,"Le numéro de téléphone du standard de l'ISET Sfax est le (+216) 74 431 133. Ce numéro est disponible pendant les heures de travail administratif, du lundi au vendredi de 8h30 à 17h30 et le samedi de 8h30 à 13h00.",/contact/telephone-standard
183,Contact,Quel est le numéro de fax de l'ISET Sfax?,"Le numéro de fax de l'ISET Sfax est le (+216) 74 431 282. Ce service est disponible 24h/24 pour la réception des documents officiels.",/contact/numero-fax
184,Contact,Quelle est l'adresse e-mail officielle de l'ISET Sfax?,"L'adresse e-mail officielle de l'ISET Sfax est contact@isetsf.rnu.tn. Cette adresse peut être utilisée pour toute demande d'information générale ou pour contacter l'administration.",/contact/email-officiel
185,Contact,Comment contacter le service de scolarité de l'ISET Sfax?,"Le service de scolarité de l'ISET Sfax peut être contacté par téléphone au (+216) 74 431 144 ou par e-mail à scolarite@isetsf.rnu.tn. Vous pouvez également vous rendre directement au bureau de la scolarité situé au bâtiment administratif, ouvert du lundi au vendredi de 8h30 à 15h30 et le samedi de 8h30 à 12h30.",/contact/service-scolarite
186,Contact,Comment contacter le directeur de l'ISET Sfax?,"Pour contacter le directeur de l'ISET Sfax, vous pouvez prendre rendez-vous auprès de son secrétariat au (+216) 74 431 134 ou envoyer un e-mail à directeur@isetsf.rnu.tn. Pour les questions urgentes, une permanence est assurée tous les mardis matin de 9h00 à 12h00 sans rendez-vous.",/contact/contacter-directeur
187,Contact,Quels sont les horaires d'ouverture de la bibliothèque de l'ISET Sfax?,"La bibliothèque de l'ISET Sfax est ouverte du lundi au vendredi de 8h00 à 18h00 et le samedi de 8h00 à 13h00. Elle reste fermée pendant les jours fériés et observe des horaires réduits pendant les vacances universitaires (généralement de 9h00 à 15h00).",/contact/horaires-bibliotheque
188,Contact,Comment contacter le service des stages et d'insertion professionnelle de l'ISET Sfax?,"Le service des stages et d'insertion professionnelle de l'ISET Sfax peut être contacté au (+216) 74 431 155 ou par e-mail à stages@isetsf.rnu.tn. Le bureau est situé au 2ème étage du bâtiment des départements et est ouvert aux étudiants du lundi au vendredi de 9h00 à 16h00.",/contact/service-stages
189,Contact,Quels sont les horaires d'ouverture du restaurant universitaire de l'ISET Sfax?,"Le restaurant universitaire de l'ISET Sfax est ouvert pour le petit-déjeuner de 7h00 à 8h30, pour le déjeuner de 11h30 à 14h00, et pour le dîner de 18h30 à 20h00 (uniquement pour les résidents des foyers universitaires). Ces horaires peuvent être légèrement modifiés pendant le mois de Ramadan et les vacances.",/contact/horaires-restaurant-universitaire
190,Contact,Comment contacter les différents départements de l'ISET Sfax ?,"Pour contacter les départements de l'ISET Sfax, vous pouvez utiliser les coordonnées suivantes : - Département Génie Électrique : (+216) 74 431 160 ou dept.ge@isetsf.rnu.tn - Département Génie Mécanique : (+216) 74 431 170 ou dept.gm@isetsf.rnu.tn - Département Génie Informatique : (+216) 74 431 180 ou dept.info@isetsf.rnu.tn - Département Sciences Économiques et Gestion : (+216) 74 431 190 ou dept.seg@isetsf.rnu.tn. Les bureaux des départements sont ouverts du lundi au vendredi de 8h30 à 16h30.",/contact/departements-contacts
191,Contact,Quel est le site web officiel de l'ISET Sfax?,"Le site web officiel de l'ISET Sfax est https://isetsf.rnu.tn/. Ce site contient toutes les informations relatives aux formations, aux actualités et aux services offerts par l'institut.",/contact/site-web-officiel
192,Contact,Comment contacter le service informatique en cas de problème technique à l'ISET Sfax?,"Le service informatique de l'ISET Sfax peut être contacté au (+216) 74 431 166 ou par e-mail à support.info@isetsf.rnu.tn. Pour les problèmes urgents concernant les laboratoires ou les salles informatiques, un technicien est disponible au bureau S12 au rez-de-chaussée du bâtiment principal.",/contact/service-informatique
193,Contact,Comment accéder au campus de l'ISET Sfax en transport en commun?,"Le campus de l'ISET Sfax est accessible en transport en commun via les lignes de bus urbains n°5 et n°10 depuis le centre-ville de Sfax. L'arrêt \"ISET\" se trouve juste devant l'entrée principale. Les bus passent toutes les 15 minutes en heures de pointe et toutes les 30 minutes le reste de la journée.",/contact/acces-transport-commun
194,Contact,Existe-t-il des pages officielles de l'ISET Sfax sur les réseaux sociaux ?,"Oui, l'ISET Sfax dispose de pages officielles sur plusieurs réseaux sociaux : - Facebook : @ISETSfaxOfficiel - Instagram : @iset_sfax_officiel - LinkedIn : Institut Supérieur des Études Technologiques de Sfax. Ces pages sont régulièrement mises à jour avec les actualités et événements de l'institut.",/contact/reseaux-sociaux
195,Contact,Comment contacter l'association des anciens étudiants de l'ISET Sfax?,"L'association des anciens étudiants de l'ISET Sfax peut être contactée par e-mail à alumni@isetsf.rnu.tn ou via sa page Facebook @AlumniISETSfax. L'association dispose également d'un bureau au sein du campus, ouvert les mercredis et vendredis après-midi de 14h00 à 17h00.",/contact/association-anciens
196,Contact,Quels sont les horaires d'ouverture du service de santé universitaire à l'ISET Sfax?,"Le service de santé universitaire de l'ISET Sfax est ouvert du lundi au vendredi de 9h00 à 16h00. Une permanence médicale est assurée par un médecin les lundis, mercredis et vendredis, et par une infirmière tous les jours. En cas d'urgence en dehors de ces horaires, contactez le gardien au (+216) 74 431 111.",/contact/service-sante
197,Contact,Comment contacter le bureau de la vie étudiante de l'ISET Sfax?,"Le bureau de la vie étudiante de l'ISET Sfax peut être contacté au (+216) 74 431 177 ou par e-mail à vie.etudiante@isetsf.rnu.tn. Ce bureau, situé au 1er étage du bâtiment administratif, est responsable des activités culturelles, sportives et associatives. Il est ouvert du lundi au vendredi de 9h00 à 16h00.",/contact/bureau-vie-etudiante
198,Contact,Comment prendre rendez-vous avec un conseiller d'orientation à l'ISET Sfax?,"Pour prendre rendez-vous avec un conseiller d'orientation à l'ISET Sfax, contactez le service d'orientation et d'encadrement au (+216) 74 431 188 ou par e-mail à orientation@isetsf.rnu.tn. Les consultations sont disponibles du lundi au jeudi de 9h00 à 15h00, sur rendez-vous uniquement.",/contact/conseiller-orientation
199,Contact,Où se trouve le bureau des relations internationales de l'ISET Sfax?,"Le bureau des relations internationales de l'ISET Sfax se trouve au 2ème étage du bâtiment administratif, bureau B208. Il peut être contacté au (+216) 74 431 199 ou par e-mail à relations.internationales@isetsf.rnu.tn. Ce bureau gère les programmes d'échange et les partenariats internationaux.",/contact/relations-internationales
200,Contact,Comment signaler un problème d'infrastructure sur le campus de l'ISET Sfax?,"Pour signaler un problème d'infrastructure sur le campus de l'ISET Sfax (fuite d'eau, panne électrique, etc.), contactez le service technique au (+216) 74 431 122 ou envoyez un e-mail à maintenance@isetsf.rnu.tn. Pour les problèmes urgents, vous pouvez également vous adresser directement au gardien à l'entrée principale.",/contact/signaler-probleme-infrastructure
201,FAQ,Comment s'inscrire en première année à l'ISET Sfax?,"L'inscription en première année à l'ISET Sfax se fait en deux étapes : 1) Orientation via la plateforme nationale www.orientation.tn après l'obtention du baccalauréat, 2) Inscription administrative à l'ISET Sfax une fois l'affectation obtenue. Les documents requis sont : carte d'identité, attestation de baccalauréat, photos d'identité, certificat médical et frais d'inscription.",/faq/inscription-premiere-annee
202,FAQ,Quelles sont les filières disponibles à l'ISET Sfax?,"L'ISET Sfax propose plusieurs filières réparties en quatre départements : Génie Électrique (électronique industrielle, automatismes et informatique industrielle), Génie Mécanique (construction et fabrication mécanique, maintenance industrielle), Génie Informatique (développement des systèmes d'information, réseaux et systèmes), et Sciences Économiques et Gestion (comptabilité, finance, marketing, commerce international).",/faq/filieres-disponibles
203,FAQ,Comment obtenir une attestation de scolarité à l'ISET Sfax?,"Pour obtenir une attestation de scolarité à l'ISET Sfax, vous devez vous présenter au service de scolarité muni de votre carte d'étudiant. Une demande peut également être faite en ligne via l'espace étudiant du site web. Le document est généralement délivré dans un délai de 24 à 48 heures. Ce service est gratuit pour les étudiants inscrits.",/faq/attestation-scolarite
204,FAQ,Comment se fait l'évaluation des étudiants à l'ISET Sfax?,"L'évaluation des étudiants à l'ISET Sfax repose sur un système mixte : contrôle continu (40% de la note finale) comprenant des tests, travaux pratiques et projets, et examens semestriels (60%). La validation d'un module nécessite une moyenne minimale de 10/20. Les étudiants n'ayant pas validé certains modules peuvent les repasser lors de la session de rattrapage.",/faq/systeme-evaluation
205,FAQ,Quelles sont les conditions de passage d'une année à l'autre à l'ISET Sfax?,"Le passage d'une année à l'autre à l'ISET Sfax est conditionné par l'obtention d'une moyenne générale annuelle d'au moins 10/20, sans aucune note éliminatoire (inférieure à 6/20) dans les modules fondamentaux. Un étudiant peut être autorisé à passer conditionnellement s'il a validé au moins 80% des crédits de l'année, avec obligation de rattraper les modules non validés.",/faq/conditions-passage
206,FAQ,Comment fonctionne le système de crédits à l'ISET Sfax?,"Le système de crédits à l'ISET Sfax suit le modèle ECTS (European Credit Transfer System). Chaque module d'enseignement correspond à un certain nombre de crédits (généralement entre 2 et 6) reflétant la charge de travail. La licence appliquée nécessite la validation de 180 crédits sur trois ans. Les crédits sont définitivement acquis une fois le module validé.",/faq/systeme-credits
207,FAQ,Quelles sont les modalités pour effectuer un stage à l'ISET Sfax?,"Pour effectuer un stage à l'ISET Sfax, l'étudiant doit d'abord trouver une entreprise d'accueil (par ses propres moyens ou avec l'aide du bureau des stages), puis retirer une convention de stage à faire signer par l'entreprise et l'ISET. Chaque étudiant est suivi par un encadrant académique. À la fin du stage, un rapport doit être rédigé et, pour les PFE, une soutenance est organisée.",/faq/modalites-stage
208,FAQ,Comment obtenir une bourse d'études à l'ISET Sfax?,"Pour obtenir une bourse d'études en tant qu'étudiant à l'ISET Sfax, vous devez déposer une demande en ligne sur le site de l'Office des Œuvres Universitaires (www.oous.rnu.tn) entre juillet et août. L'attribution se fait selon des critères sociaux et les résultats académiques. Les bourses sont versées trimestriellement. Une commission sociale peut également attribuer des aides exceptionnelles.",/faq/obtenir-bourse
209,FAQ,Comment accéder au Wi-Fi sur le campus de l'ISET Sfax?,"Pour accéder au Wi-Fi sur le campus de l'ISET Sfax, les étudiants doivent utiliser le réseau \'ISET-SFAX\' avec leurs identifiants d'espace étudiant (numéro d'inscription et mot de passe). Pour les visiteurs, un réseau \'ISET-GUEST\' est disponible avec un mot de passe temporaire à demander à l'accueil. La couverture Wi-Fi s'étend à tous les bâtiments et espaces communs du campus.",/faq/acces-wifi
210,FAQ,Quelles sont les possibilités de poursuite d'études après le diplôme de l'ISET Sfax?,"Après l'obtention du diplôme de licence appliquée de l'ISET Sfax, plusieurs possibilités de poursuite d'études s'offrent aux diplômés : master professionnel ou de recherche dans les universités tunisiennes (sur concours), écoles d'ingénieurs nationales (sur concours), ou études à l'étranger. Des accords de partenariat existent notamment avec des établissements français, canadiens et allemands.",/faq/poursuite-etudes
211,FAQ,Comment participer aux clubs et associations de l'ISET Sfax?,"Pour participer aux clubs et associations de l'ISET Sfax, les étudiants peuvent s'inscrire au début de chaque année universitaire lors de la semaine des clubs organisée en octobre. Il suffit de contacter directement les responsables des clubs ou de passer par le bureau de la vie étudiante. Les activités se déroulent principalement les mercredis après-midi, créneau réservé aux activités parascolaires.",/faq/clubs-associations
212,FAQ,Quelles sont les démarches pour changer de filière à l'ISET Sfax?,"Pour changer de filière à l'ISET Sfax, l'étudiant doit déposer une demande écrite auprès du service de scolarité à la fin de l'année universitaire, après la publication des résultats. La demande est examinée par une commission qui tient compte des résultats académiques, des places disponibles et de la compatibilité des programmes. Les changements ne sont généralement possibles qu'après la première année.",/faq/changer-filiere
